Sheet: Sheet1
E3: File types | I3: Issue activity levels | M3: Contributions over time | Q3: Project skills tags | U3: Project user skills tags | Y3: Manufacturing metadata | AC3: Standards compliance metadata | AG3: Project license | AK3: Files editability
A4: I have read the foregoing information, or it has been explained to me. I have had the opportunity to ask questions about it and any questions that I have asked have been answered to my satisfaction. I hereby give informed consent for my data to be conveyed and documented for the purpose stated above, including participation in the workshop on 27 May 2022, and that I may withdraw this consent at any time: | B4: Please choose up to two that best represents who you are when it comes to open source hardware. | C4: If you chose "Other" above, please explain here | D4: (optional) Please share any other details about your role | E4: How useful would this feature be for you? | F4: Please briefly explain your answer | G4: What do you think this feature might help you understand? | H4: If you chose "Other", please explain here | I4: How useful would this feature be for you? | J4: Please briefly explain your answer | K4: What do you think this feature might help you understand? | L4: If you chose "Other", please explain here | M4: Imagine you are seeing this as part of a project's page on Wikifactory. How useful would this feature be for you? | N4: Please briefly explain your answer | O4: What do you think this feature might help you understand? | P4: If you chose "Other", please explain here | Q4: Imagine you are seeing this as part of a project's page on Wikifactory. How useful would this feature be for you? | R4: Please briefly explain your answer | S4: What do you think this feature might help you understand? | T4: If you chose "Other", please explain here | U4: Imagine you are seeing this as part of a project's page on Wikifactory. How useful would this feature be for you? | V4: Please briefly explain your answer | W4: What do you think this feature might help you understand? | X4: If you chose "Other", please explain here | Y4: Imagine you are seeing this as part of a project's page on Wikifactory. How useful would this feature be for you? | Z4: Please briefly explain your answer | AA4: What do you think this feature might help you understand? | AB4: If you chose "Other", please explain here | AC4: Imagine you are seeing this as part of a project's page on Wikifactory. How useful would this feature be for you? | AD4: Please briefly explain why | AE4: What do you think this feature might help you understand? | AF4: If you chose "Other", please explain here | AG4: Imagine you are seeing this as part of a project's page on Wikifactory. How useful would this feature be for you? | AH4: Please briefly explain your answer | AI4: What do you think this feature might help you understand? | AJ4: If you chose "Other", please explain here | AK4: Imagine you are seeing this as part of a project's page on Wikifactory. How useful would this feature be for you? | AL4: Please explain your answers above | AM4: What do you think this feature might help you understand? | AN4: If you chose "Other", please explain here | AO4: Now, please drag and drop the elements ordered by how useful you think they would be for you. (most useful on top) | AP4: Please briefly explain your reasoning for the ranking | AQ4: Do you have any other feedback or thoughts on any of the dashboard elements presented in this survey? You can also share any thoughts you have on what factors contribute to success in open source development (OSD), and any quantitative or qualitative indicators that could be informative in a dashboard for an open source hardware project. | AR4: Would you like your name to be credited in results, reports, or papers we might publish from the workshop today? (if you answer yes, we will only publish your name, but not any other personal information you might have provided today) | AS4: Would you be interested in providing further feedback in future surveys, interviews, or workshops after today? | AT4: Credit to
A5: Yes | B5: Project owner - The primary maintainers of a project/repository on GitHub or Wikifactory. Might want to understand how active their community is or want to support/nurture the community or look for contributors.;Researcher - Typically someone from a company who wants to understand the state of the art. Could be for understanding competition or a project to build on. Or this could mean a “generic” researcher like an academic. | E5: 4 | F5: gives me an idea what type of a) software and b) expertise I'll need to modify this project | G5: The profile of a contributor to this project; Documentation of the project | I5: 4 | J5: gives me an idea of the activity of the project and how likely it is to get responses on my issue | K5: Understanding how active the project is;Popularity of the project | M5: 4 | N5: it's an indicator for ongoing activities, so I see if there's currently development carried out for a new version. however, it's not super uncommon that OSH projects choose to develop everything locally first and then publish everything as a batch | O5: Popularity of the project;Understanding how active the project is | Q5: 4 | R5: seems super cool! but I'd need to see this validated in practice. could be that tags could be _very_ outdated when I come to see them | S5: Friendliness of the project to newcomers;The profile of a contributor to this project | U5: 2 | V5: can be too generic or even misleading. e.g. "arduino" or "robotics" could relate to the hardware level, production level or software level. It's still quite helpful though to get to know new people | W5: Organisation of the project's community;The profile of a contributor to this project | Y5: 5 | Z5: ideally gives me exactly the information I'd need to assess whether I can manufacture the project myself, should contract a manufacturer or if I should modify the design for my use | AA5: Friendliness of the project to newcomers;Documentation of the project | AC5: 5 | AD5: (without personal bias) it gives a good indication for - the quality of the documentation, - how aware developers are about cross-community standards - the ability of acquiring public funding for the project | AE5: Organisation of the project's community;Documentation of the project | AG5: 5 | AH5: super essential information; this summary would also free users from the burden to actually read into the legal code of the license | AI5: Other | AJ5: incentive of the community (how broadly this invention is meant to be shared) | AK5: 5 | AL5: SUPER essential to assess the effort to modify the design | AM5: Documentation of the project;Friendliness of the project to newcomers | AO5: Manufacturing metadata;Files editability;Project license;File types;Standards compliance metadata;Issue activity levels;Project skills tags;Contributions over time;Project user skills tags | AP5: very hard choice since at least the first 3 seem essential to me and the others (except the last one) very important | AQ5: - should be implemented on many more platforms than just Wikifactory - additional field that would be helpful - age of the project - number of versions / releases published - number of maintainers / developers with most contributions (is it a 1 person project or an active community?) - response time on new issues | AR5: Yes | AS5: Yes | AT5: Martin Häuer
A6: Yes | B6: Project owner - The primary maintainers of a project/repository on GitHub or Wikifactory. Might want to understand how active their community is or want to support/nurture the community or look for contributors. | E6: 4 | F6: Allows me to get a sense of the type of project and whether I can contirbute. E..g I don't have any electrical engineering skills so those projects won't be for me :) | G6: Documentation of the project | I6: 4 | J6: It would give a sense of how active the owners are and the degree to which they engage with the community | K6: Understanding how active the project is | M6: 3 | N6: Useful, tho some projects might be "flat" for long periods of time while actually working vs publishing and documenting IRL. So perhaps not a very real-time / accurate indicator of what's going on in the trenches. | O6: Understanding how active the project is | Q6: 5 | R6: Lets me know if I could help projects that I like / find interesting, with skills that I have... | S6: The profile of a contributor to this project | U6: 5 | V6: Will let me evaluate who's responsible for e.g the super innovative "mechanical engineering", and perhaps network with them or reach out to them. | W6: The profile of a contributor to this project | Y6: 5 | Z6: Allows me to evaluate whether I can manufacturer something myself, or find manufacturers who could. | AA6: Other | AB6: Manufacturability of a project. | AC6: 3 | AD6: Moderately useful for me personally. I'd rather know that a project is indeed manufacturable and that I can re-use it in my products. | AE6: Documentation of the project | AG6: 5 | AH6: Key for people to understand, in an accessible way. | AI6: Documentation of the project;Other | AJ6: How I can use this project. | AK6: 5 | AL6: Allows me to assess how open source something truly is. Sharing editable source files is always better :) | AM6: Other | AN6: "Open-source-ness" of a project | AO6: Manufacturing metadata;Files editability;Project skills tags;Project user skills tags;Project license;File types;Standards compliance metadata;Contributions over time;Issue activity levels | AP6: See my comments on the various individual feature pages :) | AQ6: Not for now :D | AR6: Yes | AS6: Yes | AT6: Max Kampik
A7: Yes | B7: Project owner - The primary maintainers of a project/repository on GitHub or Wikifactory. Might want to understand how active their community is or want to support/nurture the community or look for contributors. | E7: 2 | F7: this could be misleading because of complexity, filesize and so on | G7: The profile of a contributor to this project | I7: 4 | J7: activity of project is important for me. i is the project alive? does it give feedback? | K7: Understanding how active the project is | M7: 5 | N7: is the project alive. is there development? important info | O7: Understanding how active the project is | Q7: 4 | R7: this is like a invitation for developer. good idea! what skills do i need for replication? | S7: Organisation of the project's community | U7: 4 | V7: good for self promotion and as a resource info for questions. who can i ask? | W7: The profile of a contributor to this project | Y7: 5 | Z7: i wan't to search projects that i can build with my tools. | AA7: Other | AB7: the hardware requirements | AC7: 3 | AD7: good to know the project follows standards | AE7: Organisation of the project's community;Documentation of the project | AG7: 5 | AH7: absolutely necessary | AI7: Organisation of the project's community;Documentation of the project | AK7: 3 | AL7: Are there source files for the hard to edit files? are the png or pdf generated? is a generated png or pdf hard to edit or easy? | AM7: Other | AN7: does this have value? | AO7: Project license;Issue activity levels;Contributions over time;Manufacturing metadata;Project skills tags;Standards compliance metadata;Project user skills tags;File types;Files editability | AP7: i would like to see project skills, that would be nice. | AQ7: api to the dashboard data and customisation of a dashboard view would be great. | AR7: Yes | AS7: Yes | AT7: Johannes Střelka-Petz
A8: Yes | B8: Other;Project owner - The primary maintainers of a project/repository on GitHub or Wikifactory. Might want to understand how active their community is or want to support/nurture the community or look for contributors. | C8: Project Manager | E8: 4 | F8: Gives me a good overview of the type of project I'm looking at and help me prepare the for building it. | G8: Documentation of the project | I8: 3 | J8: Issue activity can let me know how active the project is, and how old it is. This would help me if I would like to replicate or ask for guidance. | K8: Friendliness of the project to newcomers;Understanding how active the project is | M8: 3 | N8: Let's me know how active it is. | O8: Understanding how active the project is | Q8: 4 | R8: Would help me see in advance if I'd like to contribute to a project based on what they're missing. Would help with finding interesting projects based on my skills. | S8: Organisation of the project's community;Friendliness of the project to newcomers | U8: 4 | V8: Could help with contacting people who are working on the project if I have any questions. | W8: The profile of a contributor to this project;Organisation of the project's community | Y8: 5 | Z8: Most useful as it helps to plan for all hardware capabilities that could be needed for the project. | AA8: Documentation of the project;Other | AB8: Tools and processes for the project. | AC8: 5 | AD8: It will help even beyond hobbyist projects with all legal issues pertaining to licensing etc. | AE8: Documentation of the project | AG8: 5 | AH8: Will be very useful when reproducing any project. | AI8: Documentation of the project;Friendliness of the project to newcomers | AK8: 2 | AL8: Would be valuable for some cases but essentially you're not classifying for editable/non-editable files when working in the development landscape. | AM8: Friendliness of the project to newcomers | AO8: Project skills tags;Manufacturing metadata;Project license;Project user skills tags;Standards compliance metadata;Contributions over time;Issue activity levels;File types;Files editability | AP8: Skills needed for the project are most important. | AQ8: Time to produce Skill level: Beginner, Intermediary, Advanced | AR8: No | AS8: Yes | AT8: Ali Naweed
A9: Yes | B9: Indirect developer - Someone looking for an existing project to replicate and tinker with. Might contribute to original project.;Educational user - Could be teacher and/or student who uses/makes open source hardware. | E9: 3 | F9: The breakdown could help to an overivew of the quality of documentation, e.g. if the are any "blank spots" in the documentation or elements of good quality. As other parameters are influencing this and quality != quantity, it might be useful but only in combination with other indicators. | G9: Documentation of the project | I9: 4 | J9: Gives me an impression, if the project is still maintained or developed. Seems very necessary, but doesn't allow any final impression about project status (in development, roll-out, active/in maintenance). | K9: Popularity of the project;Understanding how active the project is | M9: 4 | N9: Useful. Could be included in the "issues graph". Or a graph showing an average trend of contributions could be added to this one, making it comparable in which project phase the Open Hardware seems to be. | O9: Understanding how active the project is;Popularity of the project | Q9: 4 | R9: "Wanted" might be way more useful than "Have" | S9: The profile of a contributor to this project;Organisation of the project's community | U9: 3 | V9: This is useful. It could be improved by skill categories (e.g. Microcontroller Programming, CAD) and sub-categories (Arduino, WikiFactory/FreeCAD), that could could be grouped with categories in bright and sub-categories in shaded colours. | W9: The profile of a contributor to this project;Organisation of the project's community | Y9: 5 | Z9: Very useful to popularize Open Hardware application | AA9: Friendliness of the project to newcomers;Popularity of the project | AC9: 4 | AD9: Useful for application and even for analyizing the acceptance of different standards in the Open Hardware community | AE9: Friendliness of the project to newcomers;Documentation of the project | AG9: 5 | AH9: Absolutely necessary and useful | AI9: Popularity of the project;Documentation of the project | AK9: 4 | AL9: This could help to foster the "turn to open software for open hardware" over time | AM9: Friendliness of the project to newcomers;Documentation of the project | AO9: Project license;Files editability;Manufacturing metadata;Issue activity levels;Standards compliance metadata;Contributions over time;File types;Project skills tags;Project user skills tags | AP9: Depends totally on your target group (if you want to foster community cooperation or make Open Hardware applicable for broad range of people not familiar with OH yet) | AR9: No | AS9: No
A10: Yes | B10: Educational user - Could be teacher and/or student who uses/makes open source hardware.;Researcher - Typically an academic or someone from a company who wants to understand the state of the art. | E10: 4 | F10: This helps me to identify well documented projects where there is a good amount of informaiton and a good virety of informaiton. | G10: The profile of a contributor to this project;Documentation of the project | I10: 3 | K10: Popularity of the project;Understanding how active the project is | M10: 3 | O10: Understanding how active the project is | Q10: 5 | R10: very important to understand who is contributing and what are the missing competencies | S10: Organisation of the project's community;The profile of a contributor to this project | U10: 4 | V10: I miss here the role in the project. | W10: The profile of a contributor to this project;Understanding how active the project is | Y10: 2 | Z10: This information is very difficult to summarize as the detail of ths information required depends on the skill of the person and on its objective. I do not think it is very helpful. | AA10: Documentation of the project;Friendliness of the project to newcomers | AC10: 3 | AD10: Standards help to structure a documentation and ensure a minimum of completenes, but they are far to ensure a good replicability, modifiability etc... | AE10: Documentation of the project;Organisation of the project's community | AG10: 5 | AH10: compulsory for a good understanding of the project's orientation | AI10: Other | AJ10: I think an item on "openess" is a good indicator for users/contributors. | AK10: 3 | AL10: I think this is a good indication of the openess of hte project | AM10: Friendliness of the project to newcomers;Documentation of the project | AO10: Project skills tags;Project user skills tags;Project license;File types;Files editability;Manufacturing metadata;Standards compliance metadata;Issue activity levels;Contributions over time | AQ10: As this is not a git like version management system I was wondering if we could follow the forks of the project to see how it is expanding and how popular it is. | AR10: Yes | AS10: Yes | AT10: Jean-François Boujut
A11: Yes | B11: Project owner - The primary maintainer of a project on Wikifactory of GitHub.;Direct contributor - Someone looking to contribute to a project. | E11: 3 | F11: looks cool, but in my projects case it doesn't add any real insight to the project or its function. | G11: Documentation of the project | I11: 3 | J11: As the project owner and the main contributor, my familiarity with it current state is quite intimate, this would likely be useful where there is more collaboration. | K11: Understanding how active the project is | M11: 3 | N11: unless the project is quite large and active this is interesting but not useful. | O11: Understanding how active the project is | Q11: 3 | R11: this would be useful if your trying to attract a particular skillset | S11: The profile of a contributor to this project | U11: 3 | V11: evaluates how useful a particular contributors skillset is to the goals of the project | W11: The profile of a contributor to this project | Y11: 4 | Z11: However, this kind of breakdown will be a part of the "Digital Templates" that my project has for each of its mechanical components - i.e. how its made, with g-code, in what order, by which versions of which machines, the skills of the operator should become irrelevant at some point. | AA11: Other | AB11: This is more an evaluators filter that is better as a specification match between the manufacturers capability and the components requirement, it should IMHO be a machine readable/machine criteria built onto the fabrication template. | AC11: 3 | AD11: This feature is also an embedded compliance/dependencies specification. it (My opinion again) should be part of a manufacturing template for the created product, I would think it would be a "drill down" type feature for specific components in a project, but it would be difficult to boil down on of my machines in this fashion since there will be upwards of 100's of parts all with DIN specs built to or using various ISO standards, hard to reduce that to a single reference. | AE11: Other;Documentation of the project | AF11: see argument above... | AG11: 4 | AH11: likely a drilldown feature, OR a search filter not something to see everyday | AI11: Documentation of the project | AK11: 2 | AL11: Not sure what I'd use this for, may be very useful to others. | AM11: Documentation of the project | AO11: File types;Standards compliance metadata;Manufacturing metadata;Issue activity levels;Contributions over time;Project skills tags;Project user skills tags;Project license;Files editability | AP11: My long term plan is total automation, so machine readable, standards based, metadata is the most important documentation aspect of a project. By "Total" automation. I mean I want software to look at part specs and evaluate practicality, I do not want to wade through specs manually. (yes, I know this is not today's reality ;-) | AR11: Yes | AS11: Yes | AT11: James Jones (CubeSpawn)
D12: mean: | E12: of:=AVERAGE([.E5:.E11]) -> 3.42857142857143 | H12: mean: | I12: of:=AVERAGE([.I5:.I11]) -> 3.57142857142857 | L12: mean: | M12: of:=AVERAGE([.M5:.M11]) -> 3.57142857142857 | P12: mean: | Q12: of:=AVERAGE([.Q5:.Q11]) -> 4.14285714285714 | T12: mean: | U12: of:=AVERAGE([.U5:.U11]) -> 3.57142857142857 | X12: mean: | Y12: of:=AVERAGE([.Y5:.Y11]) -> 4.42857142857143 | AB12: mean: | AC12: of:=AVERAGE([.AC5:.AC11]) -> 3.71428571428571 | AF12: mean: | AG12: of:=AVERAGE([.AG5:.AG11]) -> 4.85714285714286 | AJ12: mean: | AK12: of:=AVERAGE([.AK5:.AK11]) -> 3.42857142857143
A13: note: bold numerical scores mean the respondent did not adjust the slider, and it stayed at the default value of 3