Sheet: top projects 2022-03-31T1410Z
A1: This sheet contains a “snapshot” of featured Wikifactory projects, and the top 30 sorted by recent, followers, contributions, and views. In the order they appeared on: https://wikifactory.com/contribute/projects
B3: sort by
A4: featured projects | B4: recent | C4: followers | D4: contributions | E4: views
A5: https://wikifactory.com/@josephaklatt/shredder-basic-model-32 | B5: https://wikifactory.com/+uboopenfactory/rummikub-adapt%C3%A9-v2 | C5: https://wikifactory.com/@aeracoop/dronecoria | D5: https://wikifactory.com/@luzleanne/community-composter | E5: https://wikifactory.com/+mekanika/mekanika-cnc-router
A6: https://wikifactory.com/+dronecoria/dronecoria-frame | B6: https://wikifactory.com/+uboopenfactory/othello-adapt%C3%A9-v2 | C6: https://wikifactory.com/+mekanika/mekanika-cnc-router | D6: http://projects.fablabs.io/@cinzasr-9a7e3/tlkx-jammer-speculative | E6: https://wikifactory.com/+OttoDIY/otto-diy
A7: https://wikifactory.com/+OttoDIY/otto-diy-plus | B7: https://wikifactory.com/+uboopenfactory/jeu-32-cartes-adapt%C3%A9 | C7: https://wikifactory.com/+growstack/nextfood-aeroponics-3b | D7: https://wikifactory.com/+uboopenfactory/vas-y | E7: https://wikifactory.com/@aeracoop/dronecoria
B8: https://wikifactory.com/+uboopenfactory/carte-d%C3%A9ficients-visuels | C8: https://wikifactory.com/+elektricworks/pikon-telescope | D8: https://wikifactory.com/+labdefabudla/pabell%C3%B3n-modular | E8: https://wikifactory.com/+elektricworks/pikon-telescope
B9: https://wikifactory.com/+uboopenfactory/handihackathon-2022 | C9: https://wikifactory.com/+personalrobotics/lilli-humanoid | D9: https://wikifactory.com/@ineslalves/shelter-armis | E9: https://wikifactory.com/+OttoDIY/otto-diy-plus
B10: https://wikifactory.com/@maudtournery/r%C3%A9cr%C3%A9athon-2 | C10: http://projects.fablabs.io/@eb/smill | D10: https://wikifactory.com/+labdefabudla/pabell%C3%B3n-de-bamb%C3%BA-udla | E10: http://viralresponse.io/+carola/project-carola-alpha
B11: https://wikifactory.com/+uboopenfactory/datalogger3g | C11: https://wikifactory.com/+OttoDIY/open-edu | D11: http://viralresponse.io/+sinestesia/proyecto-zona-cero | E11: https://wikifactory.com/+growstack/nextfood-aeroponics-3b
B12: https://wikifactory.com/+uboopenfactory/othelloadapt%C3%A9vertical | C12: https://wikifactory.com/@stoneflower3d/multimaterial-3d-printing | D12: https://wikifactory.com/+uboopenfactory/fabcity-brest | E12: https://wikifactory.com/+OttoDIY/humanoid
B13: https://wikifactory.com/+unfold/merxte-para-amaz%C3%B4nia | C13: https://wikifactory.com/+OttoDIY/otto-diy | D13: https://wikifactory.com/@patriciaabasilio/fire-shelter-for-2050 | E13: https://wikifactory.com/+personalrobotics/lilli-humanoid
B14: https://wikifactory.com/@cgasparini/ottocardy-cardboard-robot | C14: https://wikifactory.com/@juan/hacked-farmbot | D14: https://wikifactory.com/+labdefabudla/pabell%C3%B3n-hex%C3%A1gonal-g3 | E14: http://projects.fablabs.io/@eb/smill
B15: https://wikifactory.com/+uboopenfactory/globeterrestre | C15: https://wikifactory.com/+colaborativaeu/domenicocc | D15: http://viralresponse.io/+carola/project-carola-alpha | E15: http://viralresponse.io/+carola/mask-press
B16: https://wikifactory.com/@fablabbahrain/fabn-a-box | C16: http://viralresponse.io/+carola/project-carola-alpha | D16: https://wikifactory.com/@inesmarquesxavier/oxygen-mask | E16: https://wikifactory.com/+colaborativaeu/domenicocc
B17: https://wikifactory.com/+uboopenfactory/borne-de-satisfaction | C17: https://wikifactory.com/@robotix/the-spider-sp-8-project | D17: https://wikifactory.com/+fablabo/studio-5-2021 | E17: https://wikifactory.com/@stoneflower3d/multimaterial-3d-printing
B18: https://wikifactory.com/@tintins/%C3%A9oliennecontrol | C18: https://wikifactory.com/+OttoDIY/otto-diy-plus | D18: https://wikifactory.com/+OttoDIY/otto-diy | E18: https://wikifactory.com/+OttoDIY/open-edu
B19: https://wikifactory.com/@federicabucchieri/alter-ego | C19: https://wikifactory.com/+most/reprapable-recyclebot | D19: https://wikifactory.com/+uboopenfactory/du-portage-au-partage | E19: https://wikifactory.com/@robotix/the-spider-sp-8-project
B20: https://wikifactory.com/@rievo/steamdeckassets | C20: http://projects.fablabs.io/+aquapioneers/aquapioneers | D20: https://wikifactory.com/@joaoinocencio/plant-shelter | E20: https://wikifactory.com/@juan/hacked-farmbot
B21: https://wikifactory.com/+uboopenfactory/basculepieds | C21: https://wikifactory.com/@sotoprecycling/smart-injector | D21: https://wikifactory.com/+OttoDIY/otto-diy-plus | E21: https://wikifactory.com/@sotoprecycling/smart-injector
B22: https://wikifactory.com/@salvagegardensg/speaking-induction-hob | C22: https://wikifactory.com/@itay/cheap-cnc-foam-cutter | D22: https://wikifactory.com/@patr%C3%ADciabaleiras/comedouro-para-p%C3%A1ssaros | E22: https://wikifactory.com/@itay/cheap-cnc-foam-cutter
B23: https://wikifactory.com/@vicckkky/flsun-sr-clay-conversion | C23: https://wikifactory.com/@owenlab/open-stage | D23: https://wikifactory.com/@marcoalpoim/compostor | E23: https://wikifactory.com/+ctc/ctc-isolation-gown
B24: https://wikifactory.com/+fablablimerick/organic | C24: https://wikifactory.com/+OttoDIY/humanoid | D24: http://projects.fablabs.io/+fablabsupsi/digitalmaking | E24: http://viralresponse.io/+makersvscovid/face-shield
B25: https://wikifactory.com/+fablablimerick/springboard22-e-mccormick | C25: https://wikifactory.com/@niko11/wind-turbine | D25: https://wikifactory.com/@ricardo-almeida/dispensador | E25: https://wikifactory.com/+most/reprapable-recyclebot
B26: https://wikifactory.com/@eoinosullivan/monte-carasso | C26: https://wikifactory.com/@jonathankeep/self-build-clay-printer | D26: https://wikifactory.com/@vsxco/dis | E26: https://wikifactory.com/+covidmakersmadrid/visera-hospitales
B27: https://wikifactory.com/+fablabbratislava/art-easel | C27: http://projects.fablabs.io/@saverio/rotocastit | D27: https://wikifactory.com/@faustofonsecaribeiro/trabalho-de-produto | E27: https://wikifactory.com/@owenlab/open-stage
B28: https://wikifactory.com/+fablabbratislava/musicbox1 | C28: https://wikifactory.com/@jetclay/jetclay-clay-extruder | D28: https://wikifactory.com/@catarinaribeiro/healthy-air-by-azicav | E28: http://viralresponse.io/@progressth/low-cost-auto-ventilator
B29: https://wikifactory.com/+fablabbratislava/a-microbit-water-rocket | C29: http://viralresponse.io/+carola/mask-press | D29: https://wikifactory.com/+uboopenfactory/kerdelune-ouvert | E29: https://wikifactory.com/+cubespawn/cubespawn-frames
B30: https://wikifactory.com/+fablabbratislava/eq3-mount-motorization | C30: http://viralresponse.io/@progressth/low-cost-auto-ventilator | D30: http://viralresponse.io/+makilab/breathoflife-in-belgium | E30: https://wikifactory.com/+OttoDIY/otto-diy-laser-cut
B31: https://wikifactory.com/@cateauoonk/liquid-lamp | C31: https://wikifactory.com/@svetlanashishkovets/smart-planter | D31: https://wikifactory.com/+uboopenfactory/horizon-futur | E31: https://wikifactory.com/+snapmaker/diy-protective-gear
B32: https://wikifactory.com/@boujut/essai-opennext-v1 | C32: http://projects.fablabs.io/+humanfablabs/mini-cnc-machine | D32: https://wikifactory.com/+uboopenfactory/distributeurgel | E32: http://projects.fablabs.io/+aquapioneers/aquapioneers
B33: https://wikifactory.com/+fablabbratislava/magicbox | C33: http://projects.fablabs.io/+fablabbcn/smart-citizen-kit | D33: https://wikifactory.com/+labdefabudla/pabell%C3%B3n-tortuga-900db | E33: https://wikifactory.com/@juan/p3steel-printer
B34: https://wikifactory.com/+uboopenfactory/murvegetalexterieur | C34: https://wikifactory.com/+distributed-hardware-hackathon/docubot | D34: https://wikifactory.com/+labdefabudla/pabell%C3%B3n-por-tensores | E34: https://wikifactory.com/+OttoDIY/dozer
B35: https://wikifactory.com/@cashmoney/cash | C35: https://wikifactory.com/+OttoDIY/bob-303 | D35: https://wikifactory.com/+e-NABLE/e-nable-spc | E35: https://wikifactory.com/@jonathankeep/self-build-clay-printer
B36: https://wikifactory.com/@ndubo/images-comestibles | C36: https://wikifactory.com/+wave-ceramics/loira-20 | D36: https://wikifactory.com/@dogukandg/twezees | E36: http://projects.fablabs.io/@mauriziovrenna/algae-grower
B37: https://wikifactory.com/+fictionfactory/cascompass | C37: https://wikifactory.com/@diaan/servo-bionic-butterfly | D37: https://wikifactory.com/+distributed-hardware-hackathon/madrid-docubot-team | E37: https://wikifactory.com/@niko11/wind-turbine
B38: https://wikifactory.com/+fablabbratislava/parking-terminal-mini | C38: http://projects.fablabs.io/+OSBeehives/colorado-top-bar-beehive | D38: https://wikifactory.com/+uboopenfactory/tri-bras-robot | E38: https://wikifactory.com/@prusalab/prusahive
B39: https://wikifactory.com/+fablabbratislava/arm-rest-organizer | C39: https://wikifactory.com/@juan/p3steel-printer | D39: https://wikifactory.com/+e-NABLE/niop-project | E39: https://wikifactory.com/+OttoDIY/otto-quad
B40: https://wikifactory.com/+fablabbratislava/music-printer | C40: https://wikifactory.com/+holybro/px4-vision | D40: https://wikifactory.com/@monterrosocarneiro/dispenser | E40: https://wikifactory.com/+holybro/px4-vision
B41: https://wikifactory.com/@chorshing/test | C41: https://wikifactory.com/@adrianacabrera/myorthotics | D41: https://wikifactory.com/+uboopenfactory/tempiece | E41: https://wikifactory.com/+wikifactory/mayku-challenge-template
B42: https://wikifactory.com/@sidsel/the-refrigeration-project-e7b34 | C42: https://wikifactory.com/+wikifactory/mayku-challenge-template | D42: https://wikifactory.com/+OttoDIY/otto-turtle-drawing-robot | E42: https://wikifactory.com/+OttoDIY/eyes
B43: https://wikifactory.com/@sidsel/manyone | C43: https://wikifactory.com/+fabsdgs/fab-sdgs-at-geneva-forum | D43: https://wikifactory.com/@alec242/dronecoria | E43: https://wikifactory.com/+OttoDIY/bob-303
B44: https://wikifactory.com/+opennext/manyone | C44: http://projects.fablabs.io/@mauriziovrenna/algae-grower | D44: https://wikifactory.com/@beatrizabrunhosa/comedouro-62ef2 | E44: https://wikifactory.com/@jetclay/jetclay-clay-extruder
B45: https://wikifactory.com/+uboopenfactory/basemobilemotorisee | C45: http://projects.opennext.eu/@xyz-cargo-add-ons/xyz-cargo-add-ons | D45: https://wikifactory.com/@ritspl/holosc%C3%B3pio | E45: https://wikifactory.com/+OttoDIY/otto-turtle-drawing-robot
B46: https://wikifactory.com/+uboopenfactory/canneamphibieadapt | C46: https://wikifactory.com/+snapmaker/diy-protective-gear | D46: https://wikifactory.com/+uboopenfactory/diygo3-rhinosim | E46: https://wikifactory.com/@diaan/servo-bionic-butterfly
B47: https://wikifactory.com/@akbarpublik34/instalation | C47: https://wikifactory.com/+wikifactory/north-star-build | D47: https://wikifactory.com/+labdefabudla/pabell%C3%B3n-jatafevacri | E47: https://wikifactory.com/+OttoDIY/w
B48: https://wikifactory.com/+uboopenfactory/cycladeelec | C48: https://wikifactory.com/+wikifactory/beta-testing-new-cad-tool | D48: https://wikifactory.com/@matildebraz/braille-box | E48: https://wikifactory.com/+ctc/ctc-coverall
B49: https://wikifactory.com/+uboopenfactory/3emeroueecologique | C49: https://wikifactory.com/+dfrobot/arduino-liedetecting-ring | D49: https://wikifactory.com/@flipflop/dispenser-project | E49: http://projects.fablabs.io/@saverio/rotocastit
B50: https://wikifactory.com/+uboopenfactory/toporganim | C50: https://wikifactory.com/+cubespawn/cubespawn-frames | D50: https://wikifactory.com/@xanacarvalho15/aqua-tube-blop | E50: http://projects.fablabs.io/+fablabbcn/smart-citizen-kit
B51: https://wikifactory.com/+uboopenfactory/oceanspy | C51: https://wikifactory.com/+fictionfactory/laser | D51: https://wikifactory.com/@lobod/tecv | E51: https://wikifactory.com/+growcab/growcab
B52: https://wikifactory.com/+uboopenfactory/macartedereperage | C52: https://wikifactory.com/@alexkimber/tension-chair | D52: https://wikifactory.com/+fablabfabbulle/01-pas-de-pauvret%C3%A9 | E52: http://projects.opennext.eu/@xyz-cargo-add-ons/xyz-cargo-add-ons
B53: https://wikifactory.com/+opennext/lydbydissing | C53: https://wikifactory.com/+covidmakersmadrid/visera-hospitales | D53: https://wikifactory.com/@ritspl/configura%C3%A7%C3%A3o-e-research | E53: https://wikifactory.com/@ejtech/soft-sound-spqr
B54: https://wikifactory.com/+uboopenfactory/diagtemphumid | C54: https://wikifactory.com/+OttoDIY/otto-quad | D54: https://wikifactory.com/@prusalab/prusahive | E54: https://wikifactory.com/+kataposte/kataposte-165
C58: 35 grey | D58: 2 grey | E58: 37 grey
C59: 2 blue | D59: 2 blue | E59: 2 blue
C60: 1 yellow | D60: 1 yellow | E60: 1 yellow

Sheet: eligible projects from 2021-03-31
C1: exclusion criteria
A2: project | B2: group | C2: open source? | D2: activity within 6 months? | E2: activity within 12 months? | F2: design files? | G2: contributions? | H2: include from past 6 months? | I2: include from past 12 months? | J2: project URL | K2: notes
A3: http://projects.fablabs.io/@eb/smill | B3: followers and views | C3: yes | D3: yes | E3: yes | F3: yes | G3: yes | H3: of:=IF(AND([.C3]="yes"; [.D3]="yes"; [.E3]="yes"; [.F3]="yes"; [.G3]="yes"); 1; 0) -> 1 | I3: of:=IF(AND([.C3]="yes"; [.E3]="yes"; [.F3]="yes"; [.G3]="yes"); 1; 0) -> 1 | J3: of:=IF(OR([.H3]=1; [.I3]=1); [.A3]; "") -> http://projects.fablabs.io/@eb/smill
A4: http://projects.fablabs.io/@mauriziovrenna/algae-grower | B4: followers and views | C4: yes | D4: yes | E4: yes | F4: yes | G4: yes | H4: of:=IF(AND([.C4]="yes"; [.D4]="yes"; [.E4]="yes"; [.F4]="yes"; [.G4]="yes"); 1; 0) -> 1 | I4: of:=IF(AND([.C4]="yes"; [.E4]="yes"; [.F4]="yes"; [.G4]="yes"); 1; 0) -> 1 | J4: of:=IF(OR([.H4]=1; [.I4]=1); [.A4]; "") -> http://projects.fablabs.io/@mauriziovrenna/algae-grower
A5: http://projects.fablabs.io/@saverio/rotocastit | B5: followers and views | C5: yes | D5: no | E5: no | F5: yes | G5: yes | H5: of:=IF(AND([.C5]="yes"; [.D5]="yes"; [.E5]="yes"; [.F5]="yes"; [.G5]="yes"); 1; 0) -> 0 | I5: of:=IF(AND([.C5]="yes"; [.E5]="yes"; [.F5]="yes"; [.G5]="yes"); 1; 0) -> 0 | J5: of:=IF(OR([.H5]=1; [.I5]=1); [.A5]; "") -> 
A6: http://projects.fablabs.io/+aquapioneers/aquapioneers | B6: followers and views | C6: no | D6: yes | E6: yes | F6: yes | G6: yes | H6: of:=IF(AND([.C6]="yes"; [.D6]="yes"; [.E6]="yes"; [.F6]="yes"; [.G6]="yes"); 1; 0) -> 0 | I6: of:=IF(AND([.C6]="yes"; [.E6]="yes"; [.F6]="yes"; [.G6]="yes"); 1; 0) -> 0 | J6: of:=IF(OR([.H6]=1; [.I6]=1); [.A6]; "") -> 
A7: http://projects.fablabs.io/+fablabbcn/smart-citizen-kit | B7: followers and views | C7: yes | D7: no | E7: yes | F7: yes | G7: yes | H7: of:=IF(AND([.C7]="yes"; [.D7]="yes"; [.E7]="yes"; [.F7]="yes"; [.G7]="yes"); 1; 0) -> 0 | I7: of:=IF(AND([.C7]="yes"; [.E7]="yes"; [.F7]="yes"; [.G7]="yes"); 1; 0) -> 1 | J7: of:=IF(OR([.H7]=1; [.I7]=1); [.A7]; "") -> http://projects.fablabs.io/+fablabbcn/smart-citizen-kit
A8: http://projects.opennext.eu/@xyz-cargo-add-ons/xyz-cargo-add-ons | B8: followers and views | C8: yes | D8: yes | E8: yes | F8: yes | G8: yes | H8: of:=IF(AND([.C8]="yes"; [.D8]="yes"; [.E8]="yes"; [.F8]="yes"; [.G8]="yes"); 1; 0) -> 1 | I8: of:=IF(AND([.C8]="yes"; [.E8]="yes"; [.F8]="yes"; [.G8]="yes"); 1; 0) -> 1 | J8: of:=IF(OR([.H8]=1; [.I8]=1); [.A8]; "") -> http://projects.opennext.eu/@xyz-cargo-add-ons/xyz-cargo-add-ons
A9: http://viralresponse.io/@progressth/low-cost-auto-ventilator | B9: followers and views | C9: no | D9: yes | E9: yes | F9: yes | G9: yes | H9: of:=IF(AND([.C9]="yes"; [.D9]="yes"; [.E9]="yes"; [.F9]="yes"; [.G9]="yes"); 1; 0) -> 0 | I9: of:=IF(AND([.C9]="yes"; [.E9]="yes"; [.F9]="yes"; [.G9]="yes"); 1; 0) -> 0 | J9: of:=IF(OR([.H9]=1; [.I9]=1); [.A9]; "") -> 
A10: http://viralresponse.io/+carola/mask-press | B10: followers and views | C10: yes | D10: no | E10: yes | F10: yes | G10: yes | H10: of:=IF(AND([.C10]="yes"; [.D10]="yes"; [.E10]="yes"; [.F10]="yes"; [.G10]="yes"); 1; 0) -> 0 | I10: of:=IF(AND([.C10]="yes"; [.E10]="yes"; [.F10]="yes"; [.G10]="yes"); 1; 0) -> 1 | J10: of:=IF(OR([.H10]=1; [.I10]=1); [.A10]; "") -> http://viralresponse.io/+carola/mask-press
A11: http://viralresponse.io/+carola/project-carola-alpha | B11: followers and views | C11: yes | D11: no | E11: yes | F11: yes | G11: yes | H11: of:=IF(AND([.C11]="yes"; [.D11]="yes"; [.E11]="yes"; [.F11]="yes"; [.G11]="yes"); 1; 0) -> 0 | I11: of:=IF(AND([.C11]="yes"; [.E11]="yes"; [.F11]="yes"; [.G11]="yes"); 1; 0) -> 1 | J11: of:=IF(OR([.H11]=1; [.I11]=1); [.A11]; "") -> http://viralresponse.io/+carola/project-carola-alpha
A12: https://wikifactory.com/@aeracoop/dronecoria | B12: followers and views | C12: yes | D12: yes | E12: yes | F12: yes | G12: yes | H12: of:=IF(AND([.C12]="yes"; [.D12]="yes"; [.E12]="yes"; [.F12]="yes"; [.G12]="yes"); 1; 0) -> 1 | I12: of:=IF(AND([.C12]="yes"; [.E12]="yes"; [.F12]="yes"; [.G12]="yes"); 1; 0) -> 1 | J12: of:=IF(OR([.H12]=1; [.I12]=1); [.A12]; "") -> https://wikifactory.com/@aeracoop/dronecoria | K12: They’ve migrated to the following new project URL, which is open source CC BY-SA: https://wikifactory.com/+dronecoria/dronecoria-frame/file/license.txt
A13: https://wikifactory.com/@diaan/servo-bionic-butterfly | B13: followers and views | C13: no | D13: yes | E13: yes | F13: yes | G13: yes | H13: of:=IF(AND([.C13]="yes"; [.D13]="yes"; [.E13]="yes"; [.F13]="yes"; [.G13]="yes"); 1; 0) -> 0 | I13: of:=IF(AND([.C13]="yes"; [.E13]="yes"; [.F13]="yes"; [.G13]="yes"); 1; 0) -> 0 | J13: of:=IF(OR([.H13]=1; [.I13]=1); [.A13]; "") -> 
A14: https://wikifactory.com/@itay/cheap-cnc-foam-cutter | B14: followers and views | C14: yes | D14: yes | E14: yes | F14: yes | G14: yes | H14: of:=IF(AND([.C14]="yes"; [.D14]="yes"; [.E14]="yes"; [.F14]="yes"; [.G14]="yes"); 1; 0) -> 1 | I14: of:=IF(AND([.C14]="yes"; [.E14]="yes"; [.F14]="yes"; [.G14]="yes"); 1; 0) -> 1 | J14: of:=IF(OR([.H14]=1; [.I14]=1); [.A14]; "") -> https://wikifactory.com/@itay/cheap-cnc-foam-cutter
A15: https://wikifactory.com/@jetclay/jetclay-clay-extruder | B15: followers and views | C15: yes | D15: yes | E15: yes | F15: yes | G15: yes | H15: of:=IF(AND([.C15]="yes"; [.D15]="yes"; [.E15]="yes"; [.F15]="yes"; [.G15]="yes"); 1; 0) -> 1 | I15: of:=IF(AND([.C15]="yes"; [.E15]="yes"; [.F15]="yes"; [.G15]="yes"); 1; 0) -> 1 | J15: of:=IF(OR([.H15]=1; [.I15]=1); [.A15]; "") -> https://wikifactory.com/@jetclay/jetclay-clay-extruder
A16: https://wikifactory.com/@jonathankeep/self-build-clay-printer | B16: followers and views | C16: yes | D16: yes | E16: yes | F16: yes | G16: yes | H16: of:=IF(AND([.C16]="yes"; [.D16]="yes"; [.E16]="yes"; [.F16]="yes"; [.G16]="yes"); 1; 0) -> 1 | I16: of:=IF(AND([.C16]="yes"; [.E16]="yes"; [.F16]="yes"; [.G16]="yes"); 1; 0) -> 1 | J16: of:=IF(OR([.H16]=1; [.I16]=1); [.A16]; "") -> https://wikifactory.com/@jonathankeep/self-build-clay-printer
A17: https://wikifactory.com/@juan/hacked-farmbot | B17: followers and views | C17: yes | D17: yes | E17: yes | F17: yes | G17: yes | H17: of:=IF(AND([.C17]="yes"; [.D17]="yes"; [.E17]="yes"; [.F17]="yes"; [.G17]="yes"); 1; 0) -> 1 | I17: of:=IF(AND([.C17]="yes"; [.E17]="yes"; [.F17]="yes"; [.G17]="yes"); 1; 0) -> 1 | J17: of:=IF(OR([.H17]=1; [.I17]=1); [.A17]; "") -> https://wikifactory.com/@juan/hacked-farmbot
A18: https://wikifactory.com/@juan/p3steel-printer | B18: followers and views | C18: yes | D18: yes | E18: yes | F18: yes | G18: yes | H18: of:=IF(AND([.C18]="yes"; [.D18]="yes"; [.E18]="yes"; [.F18]="yes"; [.G18]="yes"); 1; 0) -> 1 | I18: of:=IF(AND([.C18]="yes"; [.E18]="yes"; [.F18]="yes"; [.G18]="yes"); 1; 0) -> 1 | J18: of:=IF(OR([.H18]=1; [.I18]=1); [.A18]; "") -> https://wikifactory.com/@juan/p3steel-printer
A19: https://wikifactory.com/@niko11/wind-turbine | B19: followers and views | C19: yes | D19: no | E19: yes | F19: yes | G19: yes | H19: of:=IF(AND([.C19]="yes"; [.D19]="yes"; [.E19]="yes"; [.F19]="yes"; [.G19]="yes"); 1; 0) -> 0 | I19: of:=IF(AND([.C19]="yes"; [.E19]="yes"; [.F19]="yes"; [.G19]="yes"); 1; 0) -> 1 | J19: of:=IF(OR([.H19]=1; [.I19]=1); [.A19]; "") -> https://wikifactory.com/@niko11/wind-turbine
A20: https://wikifactory.com/@owenlab/open-stage | B20: followers and views | C20: yes | D20: no | E20: yes | F20: yes | G20: yes | H20: of:=IF(AND([.C20]="yes"; [.D20]="yes"; [.E20]="yes"; [.F20]="yes"; [.G20]="yes"); 1; 0) -> 0 | I20: of:=IF(AND([.C20]="yes"; [.E20]="yes"; [.F20]="yes"; [.G20]="yes"); 1; 0) -> 1 | J20: of:=IF(OR([.H20]=1; [.I20]=1); [.A20]; "") -> https://wikifactory.com/@owenlab/open-stage
A21: https://wikifactory.com/@prusalab/prusahive | B21: followers and views | C21: no | D21: yes | E21: yes | F21: yes | G21: yes | H21: of:=IF(AND([.C21]="yes"; [.D21]="yes"; [.E21]="yes"; [.F21]="yes"; [.G21]="yes"); 1; 0) -> 0 | I21: of:=IF(AND([.C21]="yes"; [.E21]="yes"; [.F21]="yes"; [.G21]="yes"); 1; 0) -> 0 | J21: of:=IF(OR([.H21]=1; [.I21]=1); [.A21]; "") -> 
A22: https://wikifactory.com/@robotix/the-spider-sp-8-project | B22: followers and views | C22: yes | D22: yes | E22: yes | F22: yes | G22: yes | H22: of:=IF(AND([.C22]="yes"; [.D22]="yes"; [.E22]="yes"; [.F22]="yes"; [.G22]="yes"); 1; 0) -> 1 | I22: of:=IF(AND([.C22]="yes"; [.E22]="yes"; [.F22]="yes"; [.G22]="yes"); 1; 0) -> 1 | J22: of:=IF(OR([.H22]=1; [.I22]=1); [.A22]; "") -> https://wikifactory.com/@robotix/the-spider-sp-8-project
A23: https://wikifactory.com/@sotoprecycling/smart-injector | B23: followers and views | C23: no | D23: yes | E23: yes | F23: yes | G23: yes | H23: of:=IF(AND([.C23]="yes"; [.D23]="yes"; [.E23]="yes"; [.F23]="yes"; [.G23]="yes"); 1; 0) -> 0 | I23: of:=IF(AND([.C23]="yes"; [.E23]="yes"; [.F23]="yes"; [.G23]="yes"); 1; 0) -> 0 | J23: of:=IF(OR([.H23]=1; [.I23]=1); [.A23]; "") -> 
A24: https://wikifactory.com/@stoneflower3d/multimaterial-3d-printing | B24: followers and views | C24: yes | D24: yes | E24: yes | F24: yes | G24: yes | H24: of:=IF(AND([.C24]="yes"; [.D24]="yes"; [.E24]="yes"; [.F24]="yes"; [.G24]="yes"); 1; 0) -> 1 | I24: of:=IF(AND([.C24]="yes"; [.E24]="yes"; [.F24]="yes"; [.G24]="yes"); 1; 0) -> 1 | J24: of:=IF(OR([.H24]=1; [.I24]=1); [.A24]; "") -> https://wikifactory.com/@stoneflower3d/multimaterial-3d-printing | K24: Actual design files are off Wikifactory: https://www.stoneflower3d.com/opensource/
A25: https://wikifactory.com/+colaborativaeu/domenicocc | B25: followers and views | C25: yes | D25: no | E25: yes | F25: yes | G25: yes | H25: of:=IF(AND([.C25]="yes"; [.D25]="yes"; [.E25]="yes"; [.F25]="yes"; [.G25]="yes"); 1; 0) -> 0 | I25: of:=IF(AND([.C25]="yes"; [.E25]="yes"; [.F25]="yes"; [.G25]="yes"); 1; 0) -> 1 | J25: of:=IF(OR([.H25]=1; [.I25]=1); [.A25]; "") -> https://wikifactory.com/+colaborativaeu/domenicocc
A26: https://wikifactory.com/+covidmakersmadrid/visera-hospitales | B26: followers and views | C26: yes | D26: yes | E26: yes | F26: yes | G26: yes | H26: of:=IF(AND([.C26]="yes"; [.D26]="yes"; [.E26]="yes"; [.F26]="yes"; [.G26]="yes"); 1; 0) -> 1 | I26: of:=IF(AND([.C26]="yes"; [.E26]="yes"; [.F26]="yes"; [.G26]="yes"); 1; 0) -> 1 | J26: of:=IF(OR([.H26]=1; [.I26]=1); [.A26]; "") -> https://wikifactory.com/+covidmakersmadrid/visera-hospitales
A27: https://wikifactory.com/+cubespawn/cubespawn-frames | B27: followers and views | C27: yes | D27: no | E27: yes | F27: yes | G27: yes | H27: of:=IF(AND([.C27]="yes"; [.D27]="yes"; [.E27]="yes"; [.F27]="yes"; [.G27]="yes"); 1; 0) -> 0 | I27: of:=IF(AND([.C27]="yes"; [.E27]="yes"; [.F27]="yes"; [.G27]="yes"); 1; 0) -> 1 | J27: of:=IF(OR([.H27]=1; [.I27]=1); [.A27]; "") -> https://wikifactory.com/+cubespawn/cubespawn-frames | K27: Actual design files are on GitHub: https://github.com/CubeSpawn
A28: https://wikifactory.com/+elektricworks/pikon-telescope | B28: followers and views | C28: yes | D28: yes | E28: yes | F28: yes | G28: yes | H28: of:=IF(AND([.C28]="yes"; [.D28]="yes"; [.E28]="yes"; [.F28]="yes"; [.G28]="yes"); 1; 0) -> 1 | I28: of:=IF(AND([.C28]="yes"; [.E28]="yes"; [.F28]="yes"; [.G28]="yes"); 1; 0) -> 1 | J28: of:=IF(OR([.H28]=1; [.I28]=1); [.A28]; "") -> https://wikifactory.com/+elektricworks/pikon-telescope
A29: https://wikifactory.com/+growstack/nextfood-aeroponics-3b | B29: followers and views | C29: yes | D29: yes | E29: yes | F29: yes | G29: yes | H29: of:=IF(AND([.C29]="yes"; [.D29]="yes"; [.E29]="yes"; [.F29]="yes"; [.G29]="yes"); 1; 0) -> 1 | I29: of:=IF(AND([.C29]="yes"; [.E29]="yes"; [.F29]="yes"; [.G29]="yes"); 1; 0) -> 1 | J29: of:=IF(OR([.H29]=1; [.I29]=1); [.A29]; "") -> https://wikifactory.com/+growstack/nextfood-aeroponics-3b
A30: https://wikifactory.com/+holybro/px4-vision | B30: followers and views | C30: no | D30: yes | E30: yes | F30: yes | G30: yes | H30: of:=IF(AND([.C30]="yes"; [.D30]="yes"; [.E30]="yes"; [.F30]="yes"; [.G30]="yes"); 1; 0) -> 0 | I30: of:=IF(AND([.C30]="yes"; [.E30]="yes"; [.F30]="yes"; [.G30]="yes"); 1; 0) -> 0 | J30: of:=IF(OR([.H30]=1; [.I30]=1); [.A30]; "") ->  | K30: Open source software/firmware on GitHub: https://github.com/orgs/PX4/
A31: https://wikifactory.com/+mekanika/mekanika-cnc-router | B31: followers and views | C31: no | D31: yes | E31: yes | F31: yes | G31: yes | H31: of:=IF(AND([.C31]="yes"; [.D31]="yes"; [.E31]="yes"; [.F31]="yes"; [.G31]="yes"); 1; 0) -> 0 | I31: of:=IF(AND([.C31]="yes"; [.E31]="yes"; [.F31]="yes"; [.G31]="yes"); 1; 0) -> 0 | J31: of:=IF(OR([.H31]=1; [.I31]=1); [.A31]; "") ->  | K31: Metadata says CC BY-SA, but README says CC BY-NC-SA.
A32: https://wikifactory.com/+most/reprapable-recyclebot | B32: followers and views | C32: yes | D32: yes | E32: yes | F32: yes | G32: yes | H32: of:=IF(AND([.C32]="yes"; [.D32]="yes"; [.E32]="yes"; [.F32]="yes"; [.G32]="yes"); 1; 0) -> 1 | I32: of:=IF(AND([.C32]="yes"; [.E32]="yes"; [.F32]="yes"; [.G32]="yes"); 1; 0) -> 1 | J32: of:=IF(OR([.H32]=1; [.I32]=1); [.A32]; "") -> https://wikifactory.com/+most/reprapable-recyclebot
A33: https://wikifactory.com/+OttoDIY/bob-303 | B33: followers and views | C33: yes | D33: yes | E33: yes | F33: yes | G33: yes | H33: of:=IF(AND([.C33]="yes"; [.D33]="yes"; [.E33]="yes"; [.F33]="yes"; [.G33]="yes"); 1; 0) -> 1 | I33: of:=IF(AND([.C33]="yes"; [.E33]="yes"; [.F33]="yes"; [.G33]="yes"); 1; 0) -> 1 | J33: of:=IF(OR([.H33]=1; [.I33]=1); [.A33]; "") -> https://wikifactory.com/+OttoDIY/bob-303
A34: https://wikifactory.com/+OttoDIY/humanoid | B34: followers and views | C34: yes | D34: yes | E34: yes | F34: yes | G34: yes | H34: of:=IF(AND([.C34]="yes"; [.D34]="yes"; [.E34]="yes"; [.F34]="yes"; [.G34]="yes"); 1; 0) -> 1 | I34: of:=IF(AND([.C34]="yes"; [.E34]="yes"; [.F34]="yes"; [.G34]="yes"); 1; 0) -> 1 | J34: of:=IF(OR([.H34]=1; [.I34]=1); [.A34]; "") -> https://wikifactory.com/+OttoDIY/humanoid
A35: https://wikifactory.com/+OttoDIY/open-edu | B35: followers and views | C35: yes | D35: yes | E35: yes | F35: yes | G35: yes | H35: of:=IF(AND([.C35]="yes"; [.D35]="yes"; [.E35]="yes"; [.F35]="yes"; [.G35]="yes"); 1; 0) -> 1 | I35: of:=IF(AND([.C35]="yes"; [.E35]="yes"; [.F35]="yes"; [.G35]="yes"); 1; 0) -> 1 | J35: of:=IF(OR([.H35]=1; [.I35]=1); [.A35]; "") -> https://wikifactory.com/+OttoDIY/open-edu
A36: https://wikifactory.com/+OttoDIY/otto-diy | B36: followers and views | C36: yes | D36: yes | E36: yes | F36: yes | G36: yes | H36: of:=IF(AND([.C36]="yes"; [.D36]="yes"; [.E36]="yes"; [.F36]="yes"; [.G36]="yes"); 1; 0) -> 1 | I36: of:=IF(AND([.C36]="yes"; [.E36]="yes"; [.F36]="yes"; [.G36]="yes"); 1; 0) -> 1 | J36: of:=IF(OR([.H36]=1; [.I36]=1); [.A36]; "") -> https://wikifactory.com/+OttoDIY/otto-diy
A37: https://wikifactory.com/+OttoDIY/otto-diy-plus | B37: followers and views | C37: yes | D37: yes | E37: yes | F37: yes | G37: yes | H37: of:=IF(AND([.C37]="yes"; [.D37]="yes"; [.E37]="yes"; [.F37]="yes"; [.G37]="yes"); 1; 0) -> 1 | I37: of:=IF(AND([.C37]="yes"; [.E37]="yes"; [.F37]="yes"; [.G37]="yes"); 1; 0) -> 1 | J37: of:=IF(OR([.H37]=1; [.I37]=1); [.A37]; "") -> https://wikifactory.com/+OttoDIY/otto-diy-plus
A38: https://wikifactory.com/+OttoDIY/otto-quad | B38: followers and views | C38: yes | D38: yes | E38: yes | F38: yes | G38: yes | H38: of:=IF(AND([.C38]="yes"; [.D38]="yes"; [.E38]="yes"; [.F38]="yes"; [.G38]="yes"); 1; 0) -> 1 | I38: of:=IF(AND([.C38]="yes"; [.E38]="yes"; [.F38]="yes"; [.G38]="yes"); 1; 0) -> 1 | J38: of:=IF(OR([.H38]=1; [.I38]=1); [.A38]; "") -> https://wikifactory.com/+OttoDIY/otto-quad
A39: https://wikifactory.com/+OttoDIY/otto-turtle-drawing-robot | B39: followers and views | C39: yes | D39: yes | E39: yes | F39: yes | G39: yes | H39: of:=IF(AND([.C39]="yes"; [.D39]="yes"; [.E39]="yes"; [.F39]="yes"; [.G39]="yes"); 1; 0) -> 1 | I39: of:=IF(AND([.C39]="yes"; [.E39]="yes"; [.F39]="yes"; [.G39]="yes"); 1; 0) -> 1 | J39: of:=IF(OR([.H39]=1; [.I39]=1); [.A39]; "") -> https://wikifactory.com/+OttoDIY/otto-turtle-drawing-robot
A40: https://wikifactory.com/+personalrobotics/lilli-humanoid | B40: followers and views | C40: yes | D40: no | E40: yes | F40: yes | G40: yes | H40: of:=IF(AND([.C40]="yes"; [.D40]="yes"; [.E40]="yes"; [.F40]="yes"; [.G40]="yes"); 1; 0) -> 0 | I40: of:=IF(AND([.C40]="yes"; [.E40]="yes"; [.F40]="yes"; [.G40]="yes"); 1; 0) -> 1 | J40: of:=IF(OR([.H40]=1; [.I40]=1); [.A40]; "") -> https://wikifactory.com/+personalrobotics/lilli-humanoid
A41: https://wikifactory.com/+snapmaker/diy-protective-gear | B41: followers and views | C41: yes | D41: no | E41: no | F41: yes | G41: yes | H41: of:=IF(AND([.C41]="yes"; [.D41]="yes"; [.E41]="yes"; [.F41]="yes"; [.G41]="yes"); 1; 0) -> 0 | I41: of:=IF(AND([.C41]="yes"; [.E41]="yes"; [.F41]="yes"; [.G41]="yes"); 1; 0) -> 0 | J41: of:=IF(OR([.H41]=1; [.I41]=1); [.A41]; "") -> 
A42: https://wikifactory.com/+wikifactory/mayku-challenge-template | B42: followers and views | C42: yes | D42: yes | E42: yes | F42: yes | G42: yes | H42: of:=IF(AND([.C42]="yes"; [.D42]="yes"; [.E42]="yes"; [.F42]="yes"; [.G42]="yes"); 1; 0) -> 1 | I42: of:=IF(AND([.C42]="yes"; [.E42]="yes"; [.F42]="yes"; [.G42]="yes"); 1; 0) -> 1 | J42: of:=IF(OR([.H42]=1; [.I42]=1); [.A42]; "") -> https://wikifactory.com/+wikifactory/mayku-challenge-template | K42: This is just a template project for the Mayku design challenge. Will exclude.
A43: https://wikifactory.com/@luzleanne/community-composter | B43: contributions | C43: no | D43: no | E43: yes | F43: yes | G43: yes | H43: of:=IF(AND([.C43]="yes"; [.D43]="yes"; [.E43]="yes"; [.F43]="yes"; [.G43]="yes"); 1; 0) -> 0 | I43: of:=IF(AND([.C43]="yes"; [.E43]="yes"; [.F43]="yes"; [.G43]="yes"); 1; 0) -> 0 | J43: of:=IF(OR([.H43]=1; [.I43]=1); [.A43]; "") -> 
A44: http://projects.fablabs.io/@cinzasr-9a7e3/tlkx-jammer-speculative | B44: contributions | C44: no | D44: no | E44: yes | F44: yes | G44: yes | H44: of:=IF(AND([.C44]="yes"; [.D44]="yes"; [.E44]="yes"; [.F44]="yes"; [.G44]="yes"); 1; 0) -> 0 | I44: of:=IF(AND([.C44]="yes"; [.E44]="yes"; [.F44]="yes"; [.G44]="yes"); 1; 0) -> 0 | J44: of:=IF(OR([.H44]=1; [.I44]=1); [.A44]; "") -> 
A45: https://wikifactory.com/+uboopenfactory/vas-y | B45: contributions | C45: no | D45: yes | E45: yes | F45: yes | G45: yes | H45: of:=IF(AND([.C45]="yes"; [.D45]="yes"; [.E45]="yes"; [.F45]="yes"; [.G45]="yes"); 1; 0) -> 0 | I45: of:=IF(AND([.C45]="yes"; [.E45]="yes"; [.F45]="yes"; [.G45]="yes"); 1; 0) -> 0 | J45: of:=IF(OR([.H45]=1; [.I45]=1); [.A45]; "") -> 
A46: https://wikifactory.com/+labdefabudla/pabell%C3%B3n-modular | B46: contributions | C46: yes | D46: no | E46: yes | F46: yes | G46: yes | H46: of:=IF(AND([.C46]="yes"; [.D46]="yes"; [.E46]="yes"; [.F46]="yes"; [.G46]="yes"); 1; 0) -> 0 | I46: of:=IF(AND([.C46]="yes"; [.E46]="yes"; [.F46]="yes"; [.G46]="yes"); 1; 0) -> 1 | J46: of:=IF(OR([.H46]=1; [.I46]=1); [.A46]; "") -> https://wikifactory.com/+labdefabudla/pabell%C3%B3n-modular
A47: https://wikifactory.com/@ineslalves/shelter-armis | B47: contributions | C47: yes | D47: no | E47: yes | F47: yes | G47: yes | H47: of:=IF(AND([.C47]="yes"; [.D47]="yes"; [.E47]="yes"; [.F47]="yes"; [.G47]="yes"); 1; 0) -> 0 | I47: of:=IF(AND([.C47]="yes"; [.E47]="yes"; [.F47]="yes"; [.G47]="yes"); 1; 0) -> 1 | J47: of:=IF(OR([.H47]=1; [.I47]=1); [.A47]; "") -> https://wikifactory.com/@ineslalves/shelter-armis
A48: https://wikifactory.com/+labdefabudla/pabell%C3%B3n-de-bamb%C3%BA-udla | B48: contributions | C48: yes | D48: no | E48: yes | F48: yes | G48: yes | H48: of:=IF(AND([.C48]="yes"; [.D48]="yes"; [.E48]="yes"; [.F48]="yes"; [.G48]="yes"); 1; 0) -> 0 | I48: of:=IF(AND([.C48]="yes"; [.E48]="yes"; [.F48]="yes"; [.G48]="yes"); 1; 0) -> 1 | J48: of:=IF(OR([.H48]=1; [.I48]=1); [.A48]; "") -> https://wikifactory.com/+labdefabudla/pabell%C3%B3n-de-bamb%C3%BA-udla
A49: http://viralresponse.io/+sinestesia/proyecto-zona-cero | B49: contributions | C49: yes | D49: no | E49: no | F49: yes | G49: yes | H49: of:=IF(AND([.C49]="yes"; [.D49]="yes"; [.E49]="yes"; [.F49]="yes"; [.G49]="yes"); 1; 0) -> 0 | I49: of:=IF(AND([.C49]="yes"; [.E49]="yes"; [.F49]="yes"; [.G49]="yes"); 1; 0) -> 0 | J49: of:=IF(OR([.H49]=1; [.I49]=1); [.A49]; "") -> 
A50: https://wikifactory.com/+uboopenfactory/fabcity-brest | B50: contributions | C50: no | D50: yes | E50: yes | F50: yes | G50: yes | H50: of:=IF(AND([.C50]="yes"; [.D50]="yes"; [.E50]="yes"; [.F50]="yes"; [.G50]="yes"); 1; 0) -> 0 | I50: of:=IF(AND([.C50]="yes"; [.E50]="yes"; [.F50]="yes"; [.G50]="yes"); 1; 0) -> 0 | J50: of:=IF(OR([.H50]=1; [.I50]=1); [.A50]; "") ->  | K50: A project holding files describing a fablab, so not really hardware.
A51: https://wikifactory.com/@patriciaabasilio/fire-shelter-for-2050 | B51: contributions | C51: no | D51: no | E51: no | F51: yes | G51: yes | H51: of:=IF(AND([.C51]="yes"; [.D51]="yes"; [.E51]="yes"; [.F51]="yes"; [.G51]="yes"); 1; 0) -> 0 | I51: of:=IF(AND([.C51]="yes"; [.E51]="yes"; [.F51]="yes"; [.G51]="yes"); 1; 0) -> 0 | J51: of:=IF(OR([.H51]=1; [.I51]=1); [.A51]; "") -> 
A52: https://wikifactory.com/+labdefabudla/pabell%C3%B3n-hex%C3%A1gonal-g3 | B52: contributions | C52: yes | D52: yes | E52: yes | F52: yes | G52: yes | H52: of:=IF(AND([.C52]="yes"; [.D52]="yes"; [.E52]="yes"; [.F52]="yes"; [.G52]="yes"); 1; 0) -> 1 | I52: of:=IF(AND([.C52]="yes"; [.E52]="yes"; [.F52]="yes"; [.G52]="yes"); 1; 0) -> 1 | J52: of:=IF(OR([.H52]=1; [.I52]=1); [.A52]; "") -> https://wikifactory.com/+labdefabudla/pabell%C3%B3n-hex%C3%A1gonal-g3
A53: https://wikifactory.com/@inesmarquesxavier/oxygen-mask | B53: contributions | C53: no | D53: no | E53: yes | F53: yes | G53: yes | H53: of:=IF(AND([.C53]="yes"; [.D53]="yes"; [.E53]="yes"; [.F53]="yes"; [.G53]="yes"); 1; 0) -> 0 | I53: of:=IF(AND([.C53]="yes"; [.E53]="yes"; [.F53]="yes"; [.G53]="yes"); 1; 0) -> 0 | J53: of:=IF(OR([.H53]=1; [.I53]=1); [.A53]; "") -> 
A54: https://wikifactory.com/+fablabo/studio-5-2021 | B54: contributions | C54: no | D54: yes | E54: yes | F54: yes | G54: yes | H54: of:=IF(AND([.C54]="yes"; [.D54]="yes"; [.E54]="yes"; [.F54]="yes"; [.G54]="yes"); 1; 0) -> 0 | I54: of:=IF(AND([.C54]="yes"; [.E54]="yes"; [.F54]="yes"; [.G54]="yes"); 1; 0) -> 0 | J54: of:=IF(OR([.H54]=1; [.I54]=1); [.A54]; "") ->  | K54: Has sub-folders representing different student projects.
A55: https://wikifactory.com/+uboopenfactory/du-portage-au-partage | B55: contributions | C55: no | D55: yes | E55: yes | F55: yes | G55: yes | H55: of:=IF(AND([.C55]="yes"; [.D55]="yes"; [.E55]="yes"; [.F55]="yes"; [.G55]="yes"); 1; 0) -> 0 | I55: of:=IF(AND([.C55]="yes"; [.E55]="yes"; [.F55]="yes"; [.G55]="yes"); 1; 0) -> 0 | J55: of:=IF(OR([.H55]=1; [.I55]=1); [.A55]; "") ->  | K55: Looks like event documentation.
A56: https://wikifactory.com/@joaoinocencio/plant-shelter | B56: contributions | C56: no | D56: yes | E56: yes | F56: yes | G56: yes | H56: of:=IF(AND([.C56]="yes"; [.D56]="yes"; [.E56]="yes"; [.F56]="yes"; [.G56]="yes"); 1; 0) -> 0 | I56: of:=IF(AND([.C56]="yes"; [.E56]="yes"; [.F56]="yes"; [.G56]="yes"); 1; 0) -> 0 | J56: of:=IF(OR([.H56]=1; [.I56]=1); [.A56]; "") -> 
A57: https://wikifactory.com/@patr%C3%ADciabaleiras/comedouro-para-p%C3%A1ssaros | B57: contributions | C57: no | D57: no | E57: yes | F57: yes | G57: yes | H57: of:=IF(AND([.C57]="yes"; [.D57]="yes"; [.E57]="yes"; [.F57]="yes"; [.G57]="yes"); 1; 0) -> 0 | I57: of:=IF(AND([.C57]="yes"; [.E57]="yes"; [.F57]="yes"; [.G57]="yes"); 1; 0) -> 0 | J57: of:=IF(OR([.H57]=1; [.I57]=1); [.A57]; "") -> 
A58: https://wikifactory.com/@marcoalpoim/compostor | B58: contributions | C58: yes | D58: yes | E58: yes | F58: yes | G58: yes | H58: of:=IF(AND([.C58]="yes"; [.D58]="yes"; [.E58]="yes"; [.F58]="yes"; [.G58]="yes"); 1; 0) -> 1 | I58: of:=IF(AND([.C58]="yes"; [.E58]="yes"; [.F58]="yes"; [.G58]="yes"); 1; 0) -> 1 | J58: of:=IF(OR([.H58]=1; [.I58]=1); [.A58]; "") -> https://wikifactory.com/@marcoalpoim/compostor | K58: The README states open source, but didn’t specify license.
A59: http://projects.fablabs.io/+fablabsupsi/digitalmaking | B59: contributions | C59: yes | D59: yes | E59: yes | F59: no | G59: yes | H59: of:=IF(AND([.C59]="yes"; [.D59]="yes"; [.E59]="yes"; [.F59]="yes"; [.G59]="yes"); 1; 0) -> 0 | I59: of:=IF(AND([.C59]="yes"; [.E59]="yes"; [.F59]="yes"; [.G59]="yes"); 1; 0) -> 0 | J59: of:=IF(OR([.H59]=1; [.I59]=1); [.A59]; "") ->  | K59: This is documentation for a workshop, so no hardware designs.
A60: https://wikifactory.com/@ricardo-almeida/dispensador | B60: contributions | C60: no | D60: no | E60: yes | F60: yes | G60: yes | H60: of:=IF(AND([.C60]="yes"; [.D60]="yes"; [.E60]="yes"; [.F60]="yes"; [.G60]="yes"); 1; 0) -> 0 | I60: of:=IF(AND([.C60]="yes"; [.E60]="yes"; [.F60]="yes"; [.G60]="yes"); 1; 0) -> 0 | J60: of:=IF(OR([.H60]=1; [.I60]=1); [.A60]; "") -> 
A61: https://wikifactory.com/@vsxco/dis | B61: contributions | C61: no | D61: yes | E61: yes | F61: yes | G61: yes | H61: of:=IF(AND([.C61]="yes"; [.D61]="yes"; [.E61]="yes"; [.F61]="yes"; [.G61]="yes"); 1; 0) -> 0 | I61: of:=IF(AND([.C61]="yes"; [.E61]="yes"; [.F61]="yes"; [.G61]="yes"); 1; 0) -> 0 | J61: of:=IF(OR([.H61]=1; [.I61]=1); [.A61]; "") -> 
A62: https://wikifactory.com/@faustofonsecaribeiro/trabalho-de-produto | B62: contributions | C62: no | D62: no | E62: yes | F62: yes | G62: yes | H62: of:=IF(AND([.C62]="yes"; [.D62]="yes"; [.E62]="yes"; [.F62]="yes"; [.G62]="yes"); 1; 0) -> 0 | I62: of:=IF(AND([.C62]="yes"; [.E62]="yes"; [.F62]="yes"; [.G62]="yes"); 1; 0) -> 0 | J62: of:=IF(OR([.H62]=1; [.I62]=1); [.A62]; "") -> 
A63: https://wikifactory.com/@catarinaribeiro/healthy-air-by-azicav | B63: contributions | C63: no | D63: no | E63: no | F63: yes | G63: yes | H63: of:=IF(AND([.C63]="yes"; [.D63]="yes"; [.E63]="yes"; [.F63]="yes"; [.G63]="yes"); 1; 0) -> 0 | I63: of:=IF(AND([.C63]="yes"; [.E63]="yes"; [.F63]="yes"; [.G63]="yes"); 1; 0) -> 0 | J63: of:=IF(OR([.H63]=1; [.I63]=1); [.A63]; "") -> 
A64: https://wikifactory.com/+uboopenfactory/kerdelune-ouvert | B64: contributions | C64: no | D64: yes | E64: yes | F64: yes | G64: yes | H64: of:=IF(AND([.C64]="yes"; [.D64]="yes"; [.E64]="yes"; [.F64]="yes"; [.G64]="yes"); 1; 0) -> 0 | I64: of:=IF(AND([.C64]="yes"; [.E64]="yes"; [.F64]="yes"; [.G64]="yes"); 1; 0) -> 0 | J64: of:=IF(OR([.H64]=1; [.I64]=1); [.A64]; "") ->  | K64: Looks like event documentation.
A65: http://viralresponse.io/+makilab/breathoflife-in-belgium | B65: contributions | C65: yes | D65: yes | E65: yes | F65: yes | G65: yes | H65: of:=IF(AND([.C65]="yes"; [.D65]="yes"; [.E65]="yes"; [.F65]="yes"; [.G65]="yes"); 1; 0) -> 1 | I65: of:=IF(AND([.C65]="yes"; [.E65]="yes"; [.F65]="yes"; [.G65]="yes"); 1; 0) -> 1 | J65: of:=IF(OR([.H65]=1; [.I65]=1); [.A65]; "") -> http://viralresponse.io/+makilab/breathoflife-in-belgium
A66: https://wikifactory.com/+uboopenfactory/horizon-futur | B66: contributions | C66: yes | D66: yes | E66: yes | F66: yes | G66: yes | H66: of:=IF(AND([.C66]="yes"; [.D66]="yes"; [.E66]="yes"; [.F66]="yes"; [.G66]="yes"); 1; 0) -> 1 | I66: of:=IF(AND([.C66]="yes"; [.E66]="yes"; [.F66]="yes"; [.G66]="yes"); 1; 0) -> 1 | J66: of:=IF(OR([.H66]=1; [.I66]=1); [.A66]; "") -> https://wikifactory.com/+uboopenfactory/horizon-futur
A67: https://wikifactory.com/+uboopenfactory/distributeurgel | B67: contributions | C67: yes | D67: yes | E67: yes | F67: yes | G67: yes | H67: of:=IF(AND([.C67]="yes"; [.D67]="yes"; [.E67]="yes"; [.F67]="yes"; [.G67]="yes"); 1; 0) -> 1 | I67: of:=IF(AND([.C67]="yes"; [.E67]="yes"; [.F67]="yes"; [.G67]="yes"); 1; 0) -> 1 | J67: of:=IF(OR([.H67]=1; [.I67]=1); [.A67]; "") -> https://wikifactory.com/+uboopenfactory/distributeurgel
A68: https://wikifactory.com/+labdefabudla/pabell%C3%B3n-tortuga-900db | B68: contributions | C68: yes | D68: yes | E68: yes | F68: yes | G68: yes | H68: of:=IF(AND([.C68]="yes"; [.D68]="yes"; [.E68]="yes"; [.F68]="yes"; [.G68]="yes"); 1; 0) -> 1 | I68: of:=IF(AND([.C68]="yes"; [.E68]="yes"; [.F68]="yes"; [.G68]="yes"); 1; 0) -> 1 | J68: of:=IF(OR([.H68]=1; [.I68]=1); [.A68]; "") -> https://wikifactory.com/+labdefabudla/pabell%C3%B3n-tortuga-900db
A69: https://wikifactory.com/+labdefabudla/pabell%C3%B3n-por-tensores | B69: contributions | C69: yes | D69: no | E69: yes | F69: yes | G69: yes | H69: of:=IF(AND([.C69]="yes"; [.D69]="yes"; [.E69]="yes"; [.F69]="yes"; [.G69]="yes"); 1; 0) -> 0 | I69: of:=IF(AND([.C69]="yes"; [.E69]="yes"; [.F69]="yes"; [.G69]="yes"); 1; 0) -> 1 | J69: of:=IF(OR([.H69]=1; [.I69]=1); [.A69]; "") -> https://wikifactory.com/+labdefabudla/pabell%C3%B3n-por-tensores
A70: https://wikifactory.com/+e-NABLE/e-nable-spc | B70: contributions | C70: no | D70: no | E70: no | F70: no | G70: yes | H70: of:=IF(AND([.C70]="yes"; [.D70]="yes"; [.E70]="yes"; [.F70]="yes"; [.G70]="yes"); 1; 0) -> 0 | I70: of:=IF(AND([.C70]="yes"; [.E70]="yes"; [.F70]="yes"; [.G70]="yes"); 1; 0) -> 0 | J70: of:=IF(OR([.H70]=1; [.I70]=1); [.A70]; "") ->  | K70: It’s a project page, but not really for storing hardware designs.
A71: https://wikifactory.com/@dogukandg/twezees | B71: contributions | C71: yes | D71: no | E71: no | F71: yes | G71: yes | H71: of:=IF(AND([.C71]="yes"; [.D71]="yes"; [.E71]="yes"; [.F71]="yes"; [.G71]="yes"); 1; 0) -> 0 | I71: of:=IF(AND([.C71]="yes"; [.E71]="yes"; [.F71]="yes"; [.G71]="yes"); 1; 0) -> 0 | J71: of:=IF(OR([.H71]=1; [.I71]=1); [.A71]; "") -> 
A72: https://wikifactory.com/+distributed-hardware-hackathon/madrid-docubot-team | B72: contributions | C72: no | D72: no | E72: yes | F72: yes | G72: yes | H72: of:=IF(AND([.C72]="yes"; [.D72]="yes"; [.E72]="yes"; [.F72]="yes"; [.G72]="yes"); 1; 0) -> 0 | I72: of:=IF(AND([.C72]="yes"; [.E72]="yes"; [.F72]="yes"; [.G72]="yes"); 1; 0) -> 0 | J72: of:=IF(OR([.H72]=1; [.I72]=1); [.A72]; "") -> 
A73: https://wikifactory.com/+uboopenfactory/tri-bras-robot | B73: contributions | C73: yes | D73: yes | E73: yes | F73: yes | G73: yes | H73: of:=IF(AND([.C73]="yes"; [.D73]="yes"; [.E73]="yes"; [.F73]="yes"; [.G73]="yes"); 1; 0) -> 1 | I73: of:=IF(AND([.C73]="yes"; [.E73]="yes"; [.F73]="yes"; [.G73]="yes"); 1; 0) -> 1 | J73: of:=IF(OR([.H73]=1; [.I73]=1); [.A73]; "") -> https://wikifactory.com/+uboopenfactory/tri-bras-robot
A74: https://wikifactory.com/+e-NABLE/niop-project | B74: contributions | C74: no | D74: no | E74: yes | F74: yes | G74: yes | H74: of:=IF(AND([.C74]="yes"; [.D74]="yes"; [.E74]="yes"; [.F74]="yes"; [.G74]="yes"); 1; 0) -> 0 | I74: of:=IF(AND([.C74]="yes"; [.E74]="yes"; [.F74]="yes"; [.G74]="yes"); 1; 0) -> 0 | J74: of:=IF(OR([.H74]=1; [.I74]=1); [.A74]; "") -> 
A75: https://wikifactory.com/@monterrosocarneiro/dispenser | B75: contributions | C75: no | D75: no | E75: yes | F75: no | G75: yes | H75: of:=IF(AND([.C75]="yes"; [.D75]="yes"; [.E75]="yes"; [.F75]="yes"; [.G75]="yes"); 1; 0) -> 0 | I75: of:=IF(AND([.C75]="yes"; [.E75]="yes"; [.F75]="yes"; [.G75]="yes"); 1; 0) -> 0 | J75: of:=IF(OR([.H75]=1; [.I75]=1); [.A75]; "") -> 
A76: https://wikifactory.com/+uboopenfactory/tempiece | B76: contributions | C76: yes | D76: yes | E76: yes | F76: yes | G76: yes | H76: of:=IF(AND([.C76]="yes"; [.D76]="yes"; [.E76]="yes"; [.F76]="yes"; [.G76]="yes"); 1; 0) -> 1 | I76: of:=IF(AND([.C76]="yes"; [.E76]="yes"; [.F76]="yes"; [.G76]="yes"); 1; 0) -> 1 | J76: of:=IF(OR([.H76]=1; [.I76]=1); [.A76]; "") -> https://wikifactory.com/+uboopenfactory/tempiece
A77: https://wikifactory.com/@alec242/dronecoria | B77: contributions | C77: no | D77: no | E77: yes | F77: yes | G77: yes | H77: of:=IF(AND([.C77]="yes"; [.D77]="yes"; [.E77]="yes"; [.F77]="yes"; [.G77]="yes"); 1; 0) -> 0 | I77: of:=IF(AND([.C77]="yes"; [.E77]="yes"; [.F77]="yes"; [.G77]="yes"); 1; 0) -> 0 | J77: of:=IF(OR([.H77]=1; [.I77]=1); [.A77]; "") -> 
A78: https://wikifactory.com/@beatrizabrunhosa/comedouro-62ef2 | B78: contributions | C78: no | D78: no | E78: yes | F78: yes | G78: yes | H78: of:=IF(AND([.C78]="yes"; [.D78]="yes"; [.E78]="yes"; [.F78]="yes"; [.G78]="yes"); 1; 0) -> 0 | I78: of:=IF(AND([.C78]="yes"; [.E78]="yes"; [.F78]="yes"; [.G78]="yes"); 1; 0) -> 0 | J78: of:=IF(OR([.H78]=1; [.I78]=1); [.A78]; "") -> 
A79: https://wikifactory.com/@ritspl/holosc%C3%B3pio | B79: contributions | C79: no | D79: no | E79: yes | F79: yes | G79: yes | H79: of:=IF(AND([.C79]="yes"; [.D79]="yes"; [.E79]="yes"; [.F79]="yes"; [.G79]="yes"); 1; 0) -> 0 | I79: of:=IF(AND([.C79]="yes"; [.E79]="yes"; [.F79]="yes"; [.G79]="yes"); 1; 0) -> 0 | J79: of:=IF(OR([.H79]=1; [.I79]=1); [.A79]; "") -> 
A80: https://wikifactory.com/+uboopenfactory/diygo3-rhinosim | B80: contributions | C80: no | D80: yes | E80: yes | F80: yes | G80: yes | H80: of:=IF(AND([.C80]="yes"; [.D80]="yes"; [.E80]="yes"; [.F80]="yes"; [.G80]="yes"); 1; 0) -> 0 | I80: of:=IF(AND([.C80]="yes"; [.E80]="yes"; [.F80]="yes"; [.G80]="yes"); 1; 0) -> 0 | J80: of:=IF(OR([.H80]=1; [.I80]=1); [.A80]; "") -> 
A81: https://wikifactory.com/+labdefabudla/pabell%C3%B3n-jatafevacri | B81: contributions | C81: yes | D81: no | E81: yes | F81: yes | G81: yes | H81: of:=IF(AND([.C81]="yes"; [.D81]="yes"; [.E81]="yes"; [.F81]="yes"; [.G81]="yes"); 1; 0) -> 0 | I81: of:=IF(AND([.C81]="yes"; [.E81]="yes"; [.F81]="yes"; [.G81]="yes"); 1; 0) -> 1 | J81: of:=IF(OR([.H81]=1; [.I81]=1); [.A81]; "") -> https://wikifactory.com/+labdefabudla/pabell%C3%B3n-jatafevacri
A82: https://wikifactory.com/@matildebraz/braille-box | B82: contributions | C82: no | D82: no | E82: yes | F82: yes | G82: yes | H82: of:=IF(AND([.C82]="yes"; [.D82]="yes"; [.E82]="yes"; [.F82]="yes"; [.G82]="yes"); 1; 0) -> 0 | I82: of:=IF(AND([.C82]="yes"; [.E82]="yes"; [.F82]="yes"; [.G82]="yes"); 1; 0) -> 0 | J82: of:=IF(OR([.H82]=1; [.I82]=1); [.A82]; "") -> 
A83: https://wikifactory.com/@flipflop/dispenser-project | B83: contributions | C83: no | D83: no | E83: yes | F83: yes | G83: yes | H83: of:=IF(AND([.C83]="yes"; [.D83]="yes"; [.E83]="yes"; [.F83]="yes"; [.G83]="yes"); 1; 0) -> 0 | I83: of:=IF(AND([.C83]="yes"; [.E83]="yes"; [.F83]="yes"; [.G83]="yes"); 1; 0) -> 0 | J83: of:=IF(OR([.H83]=1; [.I83]=1); [.A83]; "") -> 
A84: https://wikifactory.com/@xanacarvalho15/aqua-tube-blop | B84: contributions | C84: no | D84: no | E84: no | F84: yes | G84: yes | H84: of:=IF(AND([.C84]="yes"; [.D84]="yes"; [.E84]="yes"; [.F84]="yes"; [.G84]="yes"); 1; 0) -> 0 | I84: of:=IF(AND([.C84]="yes"; [.E84]="yes"; [.F84]="yes"; [.G84]="yes"); 1; 0) -> 0 | J84: of:=IF(OR([.H84]=1; [.I84]=1); [.A84]; "") -> 
A85: https://wikifactory.com/@lobod/tecv | B85: contributions | C85: no | D85: no | E85: yes | F85: yes | G85: yes | H85: of:=IF(AND([.C85]="yes"; [.D85]="yes"; [.E85]="yes"; [.F85]="yes"; [.G85]="yes"); 1; 0) -> 0 | I85: of:=IF(AND([.C85]="yes"; [.E85]="yes"; [.F85]="yes"; [.G85]="yes"); 1; 0) -> 0 | J85: of:=IF(OR([.H85]=1; [.I85]=1); [.A85]; "") -> 
A86: https://wikifactory.com/+fablabfabbulle/01-pas-de-pauvret%C3%A9 | B86: contributions | C86: yes | D86: no | E86: yes | F86: no | G86: yes | H86: of:=IF(AND([.C86]="yes"; [.D86]="yes"; [.E86]="yes"; [.F86]="yes"; [.G86]="yes"); 1; 0) -> 0 | I86: of:=IF(AND([.C86]="yes"; [.E86]="yes"; [.F86]="yes"; [.G86]="yes"); 1; 0) -> 0 | J86: of:=IF(OR([.H86]=1; [.I86]=1); [.A86]; "") ->  | K86: Project page, but not used to manage hardware designs.
A87: https://wikifactory.com/@ritspl/configura%C3%A7%C3%A3o-e-research | B87: contributions | C87: no | D87: no | E87: yes | F87: yes | G87: yes | H87: of:=IF(AND([.C87]="yes"; [.D87]="yes"; [.E87]="yes"; [.F87]="yes"; [.G87]="yes"); 1; 0) -> 0 | I87: of:=IF(AND([.C87]="yes"; [.E87]="yes"; [.F87]="yes"; [.G87]="yes"); 1; 0) -> 0 | J87: of:=IF(OR([.H87]=1; [.I87]=1); [.A87]; "") -> 
G89: total projects | H89: of:=SUM([.H3:.H87]) -> 31

Sheet: WIF users to survey
A1: Projects from previous sheet that meet criteria and were active in past 12 months | B1: Unique users behind those projects
A2: http://projects.fablabs.io/@eb/smill | B2: http://projects.fablabs.io/@eb/ | C2: @aeracoop/
A3: http://projects.fablabs.io/@mauriziovrenna/algae-grower | B3: http://projects.fablabs.io/@mauriziovrenna/ | C3: @eb/
A4: http://projects.fablabs.io/+fablabbcn/smart-citizen-kit | B4: http://projects.fablabs.io/+fablabbcn/ | C4: @ineslalves/
A5: http://projects.opennext.eu/@xyz-cargo-add-ons/xyz-cargo-add-ons | B5: http://projects.opennext.eu/@xyz-cargo-add-ons/ | C5: @itay/
A6: http://viralresponse.io/+carola/mask-press | B6: http://viralresponse.io/+carola/ | C6: @jetclay/
A7: http://viralresponse.io/+carola/project-carola-alpha | B7: http://viralresponse.io/+makilab/ | C7: @jonathankeep/
A8: https://wikifactory.com/@aeracoop/dronecoria | B8: https://wikifactory.com/@aeracoop/ | C8: @juan/
A9: https://wikifactory.com/@itay/cheap-cnc-foam-cutter | B9: https://wikifactory.com/@ineslalves/ | C9: @marcoalpoim/
A10: https://wikifactory.com/@jetclay/jetclay-clay-extruder | B10: https://wikifactory.com/@itay/ | C10: @mauriziovrenna/
A11: https://wikifactory.com/@jonathankeep/self-build-clay-printer | B11: https://wikifactory.com/@jetclay/ | C11: @niko11/
A12: https://wikifactory.com/@juan/hacked-farmbot | B12: https://wikifactory.com/@jonathankeep/ | C12: @owenlab/
A13: https://wikifactory.com/@juan/p3steel-printer | B13: https://wikifactory.com/@juan/ | C13: @robotix/
A14: https://wikifactory.com/@niko11/wind-turbine | B14: https://wikifactory.com/@marcoalpoim/ | C14: @stoneflower3d/
A15: https://wikifactory.com/@owenlab/open-stage | B15: https://wikifactory.com/@niko11/ | C15: @xyz-cargo-add-ons/
A16: https://wikifactory.com/@robotix/the-spider-sp-8-project | B16: https://wikifactory.com/@owenlab/ | C16: +carola/
A17: https://wikifactory.com/@stoneflower3d/multimaterial-3d-printing | B17: https://wikifactory.com/@robotix/ | C17: +colaborativaeu/
A18: https://wikifactory.com/+colaborativaeu/domenicocc | B18: https://wikifactory.com/@stoneflower3d/ | C18: +covidmakersmadrid/
A19: https://wikifactory.com/+covidmakersmadrid/visera-hospitales | B19: https://wikifactory.com/+colaborativaeu/ | C19: +cubespawn/
A20: https://wikifactory.com/+cubespawn/cubespawn-frames | B20: https://wikifactory.com/+covidmakersmadrid/ | C20: +elektricworks/
A21: https://wikifactory.com/+elektricworks/pikon-telescope | B21: https://wikifactory.com/+cubespawn/ | C21: +fablabbcn/
A22: https://wikifactory.com/+growstack/nextfood-aeroponics-3b | B22: https://wikifactory.com/+elektricworks/ | C22: +growstack/
A23: https://wikifactory.com/+most/reprapable-recyclebot | B23: https://wikifactory.com/+growstack/ | C23: +labdefabudla/
A24: https://wikifactory.com/+OttoDIY/bob-303 | B24: https://wikifactory.com/+labdefabudla/ | C24: +makilab/
A25: https://wikifactory.com/+OttoDIY/humanoid | B25: https://wikifactory.com/+most/ | C25: +most/
A26: https://wikifactory.com/+OttoDIY/open-edu | B26: https://wikifactory.com/+OttoDIY/ | C26: +OttoDIY/
A27: https://wikifactory.com/+OttoDIY/otto-diy | B27: https://wikifactory.com/+personalrobotics/ | C27: +personalrobotics/
A28: https://wikifactory.com/+OttoDIY/otto-diy-plus | B28: https://wikifactory.com/+uboopenfactory/ | C28: +uboopenfactory/
A29: https://wikifactory.com/+OttoDIY/otto-quad | B29: https://wikifactory.com/+wikifactory/
A30: https://wikifactory.com/+OttoDIY/otto-turtle-drawing-robot
A31: https://wikifactory.com/+personalrobotics/lilli-humanoid
A32: https://wikifactory.com/+wikifactory/mayku-challenge-template
A33: https://wikifactory.com/+labdefabudla/pabell%C3%B3n-modular
A34: https://wikifactory.com/@ineslalves/shelter-armis
A35: https://wikifactory.com/+labdefabudla/pabell%C3%B3n-de-bamb%C3%BA-udla
A36: https://wikifactory.com/+labdefabudla/pabell%C3%B3n-hex%C3%A1gonal-g3
A37: https://wikifactory.com/@marcoalpoim/compostor
A38: http://viralresponse.io/+makilab/breathoflife-in-belgium
A39: https://wikifactory.com/+uboopenfactory/horizon-futur
A40: https://wikifactory.com/+uboopenfactory/distributeurgel
A41: https://wikifactory.com/+labdefabudla/pabell%C3%B3n-tortuga-900db
A42: https://wikifactory.com/+labdefabudla/pabell%C3%B3n-por-tensores
A43: https://wikifactory.com/+uboopenfactory/tri-bras-robot
A44: https://wikifactory.com/+uboopenfactory/tempiece
A45: https://wikifactory.com/+labdefabudla/pabell%C3%B3n-jatafevacri